{
  "type": "dvrk_data:stereo_alignment@1.0.0",
  "name": "dvrk_test",
  "camera": {
    "size": {
      "width": 640,
      "height": 480
    },
    "crop": {
      "width": 640,
      "height": 480
    },
    "alignment": {
      "horizontal_shift_px": 0,
      "vertical_shift_px": 0
    }
  },
  "gst_output": "@dvrk:stereo_alignment:stereo",
  "gst_input": "videotestsrc pattern=smpte is-live=true ! video/x-raw,width=1280,height=480,framerate=30/1"
}
